"id","title","date","authors","authorsInternal","topics","jel","pdf","abstract"
"2017-38","A Counterfactual Valuation of the Stock Index as a Predictor of Crashes","September 2017","Tom Roberts","TRUE","Asset Pricing,Financial stability","G,G0,G01,G1,G12,G17,G19","http://www.bankofcanada.ca/wp-content/uploads/2017/09/swp2017-38.pdf","Stock market fundamentals would not seem to meaningfully predict returns over a shorter-term horizon—instead, I shift focus to severe downside risk (i.e., crashes). I use the cointegrating relationship between the log S&P Composite Index and log earnings over 1871 to 2015, combined with smoothed earnings, to first construct a counterfactual valuation benchmark. The price-versus-benchmark residual shows an improved, and economically meaningful, logit estimation of the likelihood of a crash over alternatives such as the dividend yield and price momentum. Rolling out-of-sample estimates highlight the challenges in this task. Nevertheless, the overall results support the common popular belief that a higher stock market valuation in relation to fundamentals entails a higher risk of a crash."
"2017-39","Changes in Monetary Regimes and the Identification of Monetary Policy Shocks: Narrative Evidence from Canada","September 2017","Julien Champagne,Rodrigo Sekkel","TRUE,TRUE","Business fluctuations and cycles,Central bank research,Econometric and statistical methods,Exchange rate regimes,Inflation and prices,Inflation targets,Interest rates,Monetary Policy,Monetary policy framework","E,E3,E31,E32,E4,E43,E5,E52,E58","http://www.bankofcanada.ca/wp-content/uploads/2017/09/swp2017-39.pdf","We use narrative evidence along with a novel database of real-time data and forecasts from the Bank of Canada's staff economic projections from 1974 to 2015 to construct a new measure of monetary policy shocks and estimate the effects of monetary policy in Canada. We show that it is crucial to take into account the break in the conduct of monetary policy caused by the announcement of inflation targeting in 1991 when estimating the effects of monetary policy. For instance, we find that a 100-basis-point increase in our new shock series leads to a 1.0 per cent decrease in real GDP and a 0.4 per cent fall in the price level, while not accounting for the break leads to a permanent decrease in real GDP and a price puzzle. Finally, we compare our results with updated narrative evidence for the U.S. and the U.K. and argue that taking into account changes in the conduct of monetary policy in these countries also yields significantly different effects of monetary policy."
"2017-4","Stability and Efficiency in Decentralized Two‐Sided Markets with Weak Preferences","February 2017","Radoslav Raykov","TRUE","Economic models","C,C7,C78,D,D6,D61","http://www.bankofcanada.ca/wp-content/uploads/2017/02/swp2017-4.pdf","Many decentralized markets are able to attain a stable outcome despite the absence of a central authority (Roth and Vande Vate, 1990). A stable matching, however, need not be efficient if preferences are weak. This raises the question whether a decentralized market with weak preferences can attain Pareto efficiency in the absence of a central matchmaker. I show that when agent tastes are independent, the random stable match in a large-enough market is asymptotically Pareto efficient even with weak preferences. In fact, even moderate-sized markets can attain good efficiency levels. The average fraction of agents who can Pareto improve is below 10% in a market of size n = 79 when one side of the market has weak preferences; when both sides have weak preferences, the inefficiency falls below 10% for n > 158. This implies that approximate Pareto efficiency is attainable in a decentralized market even in the absence of a central matchmaker."
"2017-40","Government Spending Multipliers Under the Zero Lower Bound: Evidence from Japan","September 2017","Wataru Miyamoto,Thuy Lan Nguyen,Dmitriy Sergeyev","TRUE,FALSE,FALSE","Economic models,Fiscal Policy","E,E3,E32,E5,E6,E62","http://www.bankofcanada.ca/wp-content/uploads/2017/09/swp2017-40.pdf","Using a rich data set on government spending forecasts in Japan, we provide new evidence on the effects of unexpected changes in government spending when the nominal interest rate is near the zero lower bound (ZLB). The on-impact output multiplier is 1.5 in the ZLB period, and 0.6 outside of it. We estimate that government spending shocks increase both private consumption and investment during the ZLB period but crowd them out in the normal period. There is evidence that expected inflation increases by more in the ZLB period than in the normal period."
"2017-41","Global Trade Flows: Revisiting the Exchange Rate Elasticities","September 2017","Matthieu Bussière,Guillaume Gaulier,Walter Steingress","FALSE,FALSE,TRUE","Exchange rates,Inflation and prices,International topics","C,C5,C51,F,F1,F14,F3,F31,F33,F4,F41","http://www.bankofcanada.ca/wp-content/uploads/2017/09/swp2017-41.pdf","This paper contributes to the debate on the magnitude of exchange rate elasticities by providing a set of price and quantity elasticities for 51 advanced and emerging-market economies. Specifically, for each of these countries we report the elasticity of trade prices and trade quantities on both the export and on the import sides, as well as the reaction of the trade balance. To that end, we use a large unified database of highly disaggregated bilateral trade flows, covering 5,000 products and more than 160 trading partners. We present a range of estimates using not only standard regression techniques but also generated regressors that aim to address key omitted variable biases, particularly relating to unobserved marginal costs and competitor prices in the importing market. Our results show that quantity elasticities are significantly below one, pass-through is incomplete and export prices react significantly to exchange rate changes. Despite low quantity elasticities, the trade balance reacts positively to a depreciation in all countries because export and import prices adjust. Overall, our findings suggest that changes in the exchange rate can play an important role in addressing global trade imbalances."
"2017-42","Policy Rules for Capital Controls","October 2017","Gurnain Pasricha","TRUE","Exchange rate regimes,Financial stability,Financial system regulation and policies,International topics","F,F3,F4,F5,G,G0,G1","http://www.bankofcanada.ca/wp-content/uploads/2017/10/swp2017-42.pdf","This paper attempts to borrow the tradition of estimating policy reaction functions in monetary policy literature and apply it to capital controls policy literature. Using a novel weekly dataset on capital controls policy actions in 21 emerging economies over the period 1 January 2001 to 31 December 2015, I examine the mercantilist and macroprudential motivations for capital control policies. I introduce a new proxy for mercantilist motivations: the weighted appreciation of an emerging-market currency against its top five trade competitors. There is clear evidence that past emerging-market policy systematically responds to both mercantilist and macroprudential motivations. The choice of instruments is also systematic: policy-makers respond to mercantilist concerns by using both instruments — inflow tightening and outflow easing. They use only inflow tightening in response to macroprudential concerns. I also find that policy is acyclical to foreign debt but is countercyclical to domestic bank credit to the private non-financial sector. The adoption of explicit financial stability mandates by central banks or the creation of inter-agency financial stability councils increased the weight of macroprudential factors in the use of capital controls policies. Countries with higher exchange rate pass-through to export prices are more responsive to mercantilist concerns."
"2017-43","The Mode is the Message: Using Predata as Exclusion Restrictions to Evaluate Survey Design","October 2017","Heng Chen,Geoffrey R. Dunbar,Rallye Shen","TRUE,TRUE,TRUE","Econometric and statistical methods","C,C8","http://www.bankofcanada.ca/wp-content/uploads/2017/10/swp2017-43.pdf","Changes in survey mode (e.g., online, offline) may influence the values of survey responses, and may be particularly problematic when comparing repeated cross-sectional surveys. This paper identifies mode effects by correcting for both unit non-response and sampling selection using the sample profile data (predata) — the individual’s number of previous survey invitations, the number of completed past surveys, and the reward points balance. The findings show that there is statistically significant evidence of mode effects in recall and subjective questions, but not for factual ones."
"2017-44","Measuring Limits of Arbitrage in Fixed-Income Markets","October 2017","Jean-Sébastien Fontaine,Guillaume Nolin","TRUE,TRUE","Asset Pricing,Financial markets,International financial markets","G,G1,G12","http://www.bankofcanada.ca/wp-content/uploads/2017/10/swp2017-44.pdf","We use relative value to measure limits to arbitrage in fixed-income markets. Relative value captures apparent deviations from no-arbitrage relationships. It is simple, intuitive and can be computed model-free for any bond. A pseudo-trading strategy based on relative value generates higher returns than one based on the well-known noise measure. The relative value is therefore a better proxy for limits to arbitrage. We construct relative value indices for the US, UK, Japan, Germany, Italy, France, Switzerland and Canada. Limits to arbitrage increase with the scarcity of capital: we find that each index is correlated with local volatility and funding costs. Limits to arbitrage also exhibit strong commonality across countries, consistent with the international mobility of capital. The relative value indices are updated regularly and available publicly."
"2017-45","Identification of Random Resource Shares in Collective Households Without Preference Similarity Restrictions","October 2017","Geoffrey R. Dunbar,Arthur Lewbel,Krishna Pendakur","TRUE,FALSE,FALSE","Domestic demand and components,Econometric and statistical methods","C,C3,C31,D,D1,D11,D12,D13,I,I3,I32","http://www.bankofcanada.ca/wp-content/uploads/2017/10/swp2017-45.pdf","Resource shares, defined as the fraction of total household spending going to each person in a household, are important for assessing individual material well-being, inequality and poverty. They are difficult to identify because consumption is measured typically at the household level, and many goods are jointly consumed, so that individual-level consumption in multi-person households is not directly observed. We consider random resource shares, which vary across observationally identical households. We provide theorems that identify the distribution of random resource shares across households, including children’s shares. We also provide a new method of identifying the level of fixed or random resource shares that does not require previously needed preference similarity restrictions or marriage market assumptions. Our results can be applied to data with or without price variation. We apply our results to households in Malawi, estimating the distributions of child and female poverty across households."
"2017-46","On the Tail Risk Premium in the Oil Market","November 2017","Reinhard Ellwanger","TRUE","Asset Pricing,Econometric and statistical methods,Financial markets","C,C5,C53,C58,D,D8,D84,E,E4,E44,G,G1,G12,G13,Q,Q4,Q43","http://www.bankofcanada.ca/wp-content/uploads/2017/11/swp2017-46.pdf","This paper shows that changes in market participants’ fear of rare events implied by crude oil options contribute to oil price volatility and oil return predictability. Using 25 years of historical data, we document economically large tail risk premia that vary substantially over time and significantly forecast crude oil futures and spot returns. Oil futures prices increase (decrease) in the presence of upside (downside) fears in order to allow for smaller (larger) returns thereafter. This increase (decrease) is amplified for the spot price because of time varying-benefits from holding physical oil inventories that work in the same direction. We also provide support for view that that time variation in the relative importance of oil demand and supply shocks is an important determinant of oil price fluctuations and their interaction with aggregate outcomes. However, the option-implied tail risk premia are not spanned by traditional macroeconomic and oil market uncertainty measures, suggesting that time-varying oil price fears are an additional source of oil price volatility and predictability."
"2017-47","Cash Versus Card: Payment Discontinuities and the Burden of Holding Coins","November 2017","Heng Chen,Kim Huynh,Oz Shy","TRUE,TRUE,FALSE","Bank notes,Econometric and statistical methods","D,D0,D03,E,E4,E42","http://www.bankofcanada.ca/wp-content/uploads/2017/11/swp2017-47.pdf","Cash is the preferred method of payment for small value transactions generally less than $25. We provide insight to this finding with a new theoretical model that characterizes and compares consumers’ costs of paying with cash to paying with cards for each transaction. Our novel method accounts for how much change is received in the form of banknotes and metal coins, assuming that the weight and size of coins are inconvenient to carry. We use the regression discontinuity design (RDD) approach to estimate the model using the 2013 Bank of Canada Method-of-Payments (MOP) Survey and find a significant number of cash users who switch to paying with debit or credit cards at transaction values marginally above $5 and $10. We attribute this finding to the burden of receiving coins as change associated with the currency denomination structure. Our proposed methodology is general and can be applied to other countries and institutional details."
"2017-48","Optimal Interbank Regulation","November 2017","Thomas J. Carter","TRUE","Financial stability,Financial system regulation and policies","G,G0,G01,G2,G20","http://www.bankofcanada.ca/wp-content/uploads/2017/11/swp2017-48.pdf","Recent years have seen renewed interest in the regulation of interbank markets. A review of the literature in this area identifies two gaps: first, the literature has tended to make ad hoc assumptions about the interbank contract space, which makes it difficult to generate convincing policy prescriptions; second, the literature has tended to focus on ex-post interventions that kick in only after an interbank disruption has come underway (e.g., open-market operations, lender-of-last-resort interventions, bail-outs), rather than ex-ante prudential policies. In this paper, I take steps toward addressing both these gaps, namely by building a simple model for the interbank market in which banks optimally choose the form of their interbank contracts. I show that the model delivers episodes that qualitatively resemble the interbank disruptions witnessed during the financial crisis. Some important implications for policy then emerge. In particular, I show that optimal policy requires careful coordination between ex-post and ex-ante interventions, with the ex-ante component surprisingly doing most of the heavy lifting. This suggests that previous literature has underemphasized the role that ex-ante interventions have to play in optimal interbank regulation."
"2017-49","The Causal Impact of Migration on US Trade: Evidence from Political Refugees","November 2017","Walter Steingress","TRUE","International topics,Regional economic developments","F,F1,F14,F2,F22,J,J6,J61","http://www.bankofcanada.ca/wp-content/uploads/2017/11/swp2017-49.pdf","Immigrants can increase international trade by shifting preferences towards the goods of their country of origin and by reducing bilateral transaction costs. Using geographical variation across U.S. states for the period 2008 to 2013, I estimate the respective causal impact of immigrants on U.S. exports and imports. I address endogeneity and reverse causality by exploiting the exogenous allocation of political refugees within the U.S. refugee resettlement program that prevents immigrants from choosing the destination location. I find that a 10 percent increase in recent immigrants to a U.S. state raises imports from those immigrants’ country of origin by 1.2 percent and exports by 0.8 percent."
"2017-5","Canadian Bank Notes and Dominion Notes: Lessons for Digital Currencies","February 2017","Ben Fung,Scott Hendry,Warren E. Weber","TRUE,TRUE,FALSE","Bank notes,Digital Currencies,Financial services","E,E4,E41,E42,E5,E58","http://www.bankofcanada.ca/wp-content/uploads/2017/02/swp2017-5.pdf","This paper studies the period in Canada when both private bank notes and government-issued notes (Dominion notes) were simultaneously in circulation. Because both of these notes shared many of the characteristics of today's digital currencies, the experience with these notes can be used to draw lessons about how digital currencies might perform. The paper begins with a brief historical review of how these notes came into existence and of the regulations regarding their issuance. It examines historical evidence on how desirable bank notes were as media of exchange by examining how well they functioned with respect to ease of transacting, counterfeiting, safety, scarcity, and par exchange (a uniform currency). It then examines whether the introduction of government-issued notes improved how bank notes functioned as media of exchange. It finds that they did not. Improvements in the functioning of bank notes were due to changes in government regulation. Using the Canadian experience and that of the United States, the paper concludes that privately issued digital currencies will not be perfectly safe without government intervention, government-issued digital currency will not drive out existing private digital currencies, and government intervention will be required for privately issued and government-issued digital currencies to be a uniform currency."
"2017-50","Is the Discretionary Income Effect of Oil Price Shocks a Hoax?","November 2017","Christiane Baumeister,Lutz Kilian,Xiaoqing Zhou","FALSE,FALSE,FALSE","Econometric and statistical methods,International topics","C,C5,C51,Q,Q4,Q43","http://www.bankofcanada.ca/wp-content/uploads/2017/11/swp2017-50.pdf","The transmission of oil price shocks has been a question of central interest in macroeconomics since the 1970s. There has been renewed interest in this question after the large and persistent fall in the real price of oil in 2014–16. In the context of this debate, Ramey (2017) makes the striking claim that the existing literature on the transmission of oil price shocks is fundamentally confused about the question of how to quantify the effect of oil price shocks. In particular, she asserts that the discretionary income effect on private consumption, which plays a central role in contemporary accounts of the transmission of oil price shocks to the U.S. economy, makes no economic sense and has no economic foundation. Ramey suggests that the literature has too often confused the terms-of-trade effect with this discretionary income effect, and she makes the case that the effects of the oil price decline of 2014–16 on private consumption are smaller for a multitude of reasons than suggested by empirical models of the discretionary income effect. We review the main arguments in Ramey (2017) and show that none of her claims hold up to scrutiny. Our analysis highlights the theoretical basis of the discretionary income effect. We also discuss improved regression-based estimates of this effect that allow for changes in the dependence on oil and gasoline imports, and we highlight the fact that alternative estimates used by policymakers involve strong simplifying assumptions."
"2017-51","Identifying the Degree of Collusion Under Proportional Reduction","November 2017","Oleksandr Shcherbakov,Naoki Wakamori","TRUE,FALSE","Econometric and statistical methods,Market structure and pricing","C,C3,C36,D,D2,D22,L,L4,L41","http://www.bankofcanada.ca/wp-content/uploads/2017/11/swp2017-51.pdf","Proportional reduction is a common cartel practice in which cartel members reduce their output proportionately. We develop a method to quantify this reduction relative to a benchmark market equilibrium scenario and relate the reduction to the traditional conduct parameter. Our measure is continuous, allowing us to have an intuitive interpretation as the “degree of collusion” and nesting the earlier models in the existing literature. Furthermore, our methodology addresses Corts’ (1999) critique by estimating time-varying degree of collusion from a short panel of firm-level observations, exploiting firms’ ex post heterogeneity. We illustrate the method using the Joint Executive Committee railroad cartel data."
"2017-6","Optimal Capital Regulation","February 2017","Stéphane Moyen,Josef Schroth","FALSE,TRUE","Credit and credit aggregates,Financial Institutions,Financial stability,Financial system regulation and policies","E,E1,E13,E3,E32,E4,E44","http://www.bankofcanada.ca/wp-content/uploads/2017/02/swp2017-6.pdf","We study constrained-efficient bank capital regulation in a model with market-imposed equity requirements. Banks hold equity buffers to insure against sudden loss of access to funding. However, in the model, banks choose to only partially self-insure because equity is privately costly. As a result, equity requirements are occasionally binding. Constrained-efficient regulation requires banks to build up additional equity buffers and compensates them for the cost of equity with a permanent increase in lending margins. When buffers are depleted, regulation relaxes the market-imposed equity requirements by raising bank future prospects through temporarily elevated lending margins."
"2017-7","Banking Regulation and Market Making","February 2017","David A. Cimon,Corey Garriott","FALSE,TRUE","Financial markets,Financial system regulation and policies,Market structure and pricing","G,G1,G14,G2,G20,L,L1,L10","http://www.bankofcanada.ca/wp-content/uploads/2017/02/swp2017-7.pdf","We present a model of market makers subject to recent banking regulations: liquidity and capital constraints in the style of Basel III and a position limit in the style of the Volcker Rule. Regulation causes market makers to reduce their intermediation by refusing principal positions. However, it can improve the bid-ask spread because it induces new market makers to enter. Since market makers intermediate less, asset prices exhibit a liquidity premium. Costs of regulation can be assessed by measuring principal positions and asset prices but not by measuring bid-ask spreads."
"2017-8","Adoption Costs of Financial Innovation: Evidence from Italian ATM Cards","February 2017","Kim Huynh,Philipp Schmidt-Dengler,Gregor W. Smith,Angelika Welte","TRUE,FALSE,FALSE,TRUE","Bank notes,Econometric and statistical methods,Financial services","C,C3,C35,D,D1,D14,E,E4,E41","http://www.bankofcanada.ca/wp-content/uploads/2017/02/swp2017-8.pdf","The discrete choice to adopt a financial innovation affects a household’s exposure to inflation and transactions costs. We model this adoption decision as being subject to an unobserved cost. Estimating the cost requires a dynamic structural model, to which we apply a conditional choice simulation estimator. A novel feature of our method is that preference parameters are estimated separately, from the Euler equations of a shopping-time model, to aid statistical efficiency. We apply this method to study ATM card adoption in the Bank of Italy’s Survey of Household Income and Wealth. There, the implicit adoption cost is too large to be consistent with standard models of rational choice, even when sorted by age, cohort, education or region."
"2017-9","Expropriation Risk and FDI in Developing Countries: Does Return of Capital Dominate Return on Capital?","February 2017","M. Akhtaruzzaman,Nathan Berg,Christopher Hajzler","FALSE,FALSE,TRUE","Development economics,International financial markets","D,D2,D23,F,F2,F21,F23","http://www.bankofcanada.ca/wp-content/uploads/2017/02/swp2017-9.pdf","Previously reported effects of institutional quality and political risks on foreign direct investment (FDI) are mixed and, therefore, difficult to interpret. We present empirical evidence suggesting a relatively clear, statistically robust, and intuitive characterization. Institutional factors that affect the likelihood of an abrupt and total loss of foreigners’ capital (i.e., return of capital) dominate those that affect rates of return conditional on a strictly positive terminal investment value (i.e., return on capital). A one-standarddeviation reduction in expropriation risk is associated with a 72 per cent increase in FDI, which is substantially larger than the effects of any other dimensions of institutional quality simultaneously controlled for in our empirical models of FDI inflows. This evidence is consistent with the predictions of a standard theory of FDI under imperfect contract enforcement. We show in the context of a simple model with endogenous expropriation that, when there is a binding threat of expropriation, foreign investors can become unresponsive to differences in other dimensions of institutions and political risk, and may even reduce optimal investment as these institutions improve."
