"id","title","date","authors","authorsInternal","topics","jel","pdf","abstract"
"2013-46","Heterogeneous Returns to U.S. College Selectivity and the Value of Graduate Degree Attainment","December 2013","Mai Seki","FALSE","Labour markets","C,C3,C30,I,I2,I21","http://www.bankofcanada.ca/wp-content/uploads/2013/12/wp2013-46.pdf","Existing studies on the returns to college selectivity have mixed results, mainly due to the difficulty of controlling for selection into more-selective colleges based on unobserved ability. Moreover, researchers have not considered graduate degree attainment in the analysis of labour market returns to college selectivity. In this paper, I estimate the effect of a U.S. four-year undergraduate program’s selectivity on wages, including graduate degree attainment. I control for both observed and unobserved selection by extending the model of Carneiro, Hansen and Heckman (2003). There are two channels through which college selectivity affects future labour market outcomes. The first is the wage returns to college selectivity conditional on graduate degree attainment. The second is the effect of college selectivity on the probability of graduate degree attainment and the wage returns to graduate degree attainment. The results show that the former effects dominate the latter, but both are small in magnitude."
"2013-47","CoMargin","December 2013","Jorge Cruz Lopez,Jeffrey H. Harris,Christophe Hurlin,Christophe Pérignon","TRUE,FALSE,FALSE,FALSE","Econometric and statistical methods,Financial Institutions,Financial markets,Financial stability","G,G1,G13","http://www.bankofcanada.ca/wp-content/uploads/2013/12/wp2013-47.pdf","We present CoMargin, a new methodology to estimate collateral requirements for central counterparties (CCPs) in derivatives markets. CoMargin depends on both the tail risk of a given market participant and its interdependence with other participants. Our approach internalizes market interdependencies and enhances the stability of CCPs, thereby reducing the systemic risk concerns associated with them. CoMargin can be estimated using a model-free and scenario-based methodology, validated using formal statistical tests, and generalized to any number of market participants. We assess and illustrate our methodology using proprietary data from the Canadian Derivatives Clearing Corporation (CDCC). Our data set, the first one of its kind to be used in an academic study, includes daily observations of the actual trading positions of all CDCC members from 2003 to 2011. We show theoretically and empirically that CoMargin outperforms existing margining systems by stabilizing the probability and minimizing the shortfall of simultaneous margin-exceeding losses. The relative performance of our methodology increases when trading similarities across clearing members or co-movements among underlying assets increase, as was the case during the recent financial crisis."
"2013-48","Volatility Forecasting when the Noise Variance Is Time-Varying","December 2013","Selma Chaker,Nour Meddahi","FALSE,FALSE","Econometric and statistical methods,Financial markets","C,C1,C14,C5,C51,C58","http://www.bankofcanada.ca/wp-content/uploads/2013/12/wp2013-48.pdf","This paper explores the volatility forecasting implications of a model in which the friction in high-frequency prices is related to the true underlying volatility. The contribution of this paper is to propose a framework under which the realized variance may improve volatility forecasting if the noise variance is related to the true return volatility. The realized variance is defined as the sum of the squared intraday returns. When based on high-frequency returns, the realized variance would be non-informative for the true volatility under the standard framework. In this new setting, we revisit the results of Andersen et al. (2011) and quantify the predictive ability of several measures of integrated variance. Importantly, the time-varying aspect of the noise variance implies that the forecast of the integrated variance is different from the forecast of a realized measure. We characterize this difference, which is time-varying, and propose a feasible bias correction. We assess the usefulness of our approach for realistic models, then study the empirical implication of our method when dealing with forecasting integrated variance or trading options. The empirical results for Alcoa stock show several improvements resulting from the assumption of time-varying noise variance."
"2013-49","A Distributional Approach to Realized Volatility","December 2013","Selma Chaker,Nour Meddahi","FALSE,FALSE","Econometric and statistical methods,Financial markets","C,C1,C14,C5,C51,C58","http://www.bankofcanada.ca/wp-content/uploads/2013/12/wp2013-49.pdf","This paper proposes new measures of the integrated variance, measures which use high-frequency bid-ask spreads and quoted depths. The traditional approach assumes that the mid-quote is a good measure of frictionless price. However, the recent high-frequency econometric literature takes the mid-quote as a noisy measure of the frictionless price and proposes new and robust estimators of the integrated variance. This paper forgoes the common assumption of an additive friction term, and demonstrates how the quoted depth may be used in the construction of refined realized volatility measures under the assumption that the true frictionless price lies between the bid and the ask. More specifically, we make assumptions about the conditional distribution of the frictionless price given the available information, including quotes and depths. This distributional assumption leads to new measures of the integrated variance that explicitly incorporate the depths. We then empirically compare the new measures with the robust ones when dealing with forecasting integrated variance or trading options. We show that, in several cases, the new measures dominate the traditional measures."
"2013-5","Market Structure and Cost Pass-Through in Retail","March 2013","Gee Hee Hong,Nicholas Li","FALSE,FALSE","Inflation and prices,Transmission of monetary policy","E,E3,E30,E31,L,L1,L11,L16","http://www.bankofcanada.ca/wp-content/uploads/2013/03/wp2013-05.pdf","We examine the extent to which vertical and horizontal market structure can together explain incomplete retail pass-through. To answer this question, we use scanner data from a large U.S. retailer to estimate product level pass-through for three different vertical structures: national brands, private label goods not manufactured by the retailer and private label goods manufactured by the retailer. Our findings emphasize that accounting for the interaction of vertical and horizontal structure is important in understanding how market structure affects pass-through, as a reduction in double-marginalization can raise pass-through directly but can also reduce it indirectly by increasing market share."
"2013-50","Funding Advantage and Market Discipline in the Canadian Banking Sector","December 2013","Mehdi Beyhaghi,Chris D'Souza,Gordon S. Roberts","FALSE,TRUE,FALSE","Financial Institutions,Interest rates","G,G0,G01,G2,G21,G28,G3,G32,G33","http://www.bankofcanada.ca/wp-content/uploads/2013/12/wp2013-50.pdf","We employ a comprehensive data set and a variety of methods to provide evidence on the magnitude of large banks’ funding advantage in Canada, and on the extent to which market discipline exists across different securities issued by the Canadian banks. The banking sector in Canada provides a unique setting in which to examine market discipline along with the prospects of proposed reforms, because Canada has no history of government bailouts. Our results suggest that large banks likely have a funding advantage over small banks after controlling for bank-specific and market risk factors. Working with hand-collected market data on debt issues by large banks, we also find that market discipline exists for subordinated debt and not for senior debt."
"2013-51","Regime Switches in the Risk-Return Trade-Off","December 2013","Eric Ghysels,Pierre Guérin,Massimiliano Marcellino","FALSE,FALSE,FALSE","Econometric and statistical methods,Financial markets","G,G1,G10,G12","http://www.bankofcanada.ca/wp-content/uploads/2013/12/wp2013-51.pdf","This paper deals with the estimation of the risk-return trade-off. We use a MIDAS model for the conditional variance and allow for possible switches in the risk-return relation through a Markov-switching specification. We find strong evidence for regime changes in the risk-return relation. This finding is robust to a large range of specifications. In the first regime characterized by low ex-post returns and high volatility, the risk-return relation is reversed, whereas the intuitive positive risk-return trade-off holds in the second regime. The first regime is interpreted as a “flight-to-quality” regime."
"2013-52","Do Oil Price Increases Cause Higher Food Prices?","December 2013","Christiane Baumeister,Lutz Kilian","FALSE,FALSE","Inflation and prices,International topics","E,E3,E31,Q,Q1,Q11,Q4,Q42,Q43","http://www.bankofcanada.ca/wp-content/uploads/2013/12/wp2013-52.pdf","U.S. retail food price increases in recent years may seem large in nominal terms, but after adjusting for inflation have been quite modest even after the change in U.S. biofuel policies in 2006. In contrast, increases in the real prices of corn, soybeans, wheat and rice received by U.S. farmers have been more substantial and can be linked in part to increases in the real price of oil. That link, however, appears largely driven by common macroeconomic determinants of the prices of oil and agricultural commodities, rather than the pass-through from higher oil prices. We show that there is no evidence that corn ethanol mandates have created a tight link between oil and agricultural markets. Rather, increases in food commodity prices not associated with changes in global real activity appear to reflect a wide range of idiosyncratic shocks ranging from changes in biofuel policies to poor harvests. Increases in agricultural commodity prices, in turn, contribute little to U.S. retail food price increases, because of the small cost share of agricultural products in food prices. There is no evidence that oil price shocks have caused more than a negligible increase in retail food prices in recent years. Nor is there evidence for the prevailing wisdom that oil-price-driven increases in the cost of food processing, packaging, transportation and distribution are responsible for higher retail food prices. Finally, there is no evidence that oil-market-specific events or, for that matter, U.S. biofuel policies help explain the evolution of the real price of rice, which is perhaps the single most important food commodity for many developing countries."
"2013-53","Cash Management and Payment Choices: A Simulation Model with International Comparisons","December 2013","Carlos Arango,Yassine Bouhdaoui,David Bounie,Martina Eschelbach,Lola Hernández","FALSE,FALSE,FALSE,FALSE,FALSE","Bank notes,Financial services,International topics","C,C6,C61,E,E4,E41,E47","http://www.bankofcanada.ca/wp-content/uploads/2013/12/wp2013-53.pdf","Despite various payment innovations, today, cash is still heavily used to pay for low-value purchases. This paper develops a simulation model to test whether standard implications of the theory on cash management and payment choices can explain the use of payment instruments by transaction size. In particular, using diary survey data from Canada, France, Germany and the Netherlands, we test the assumption that cash is still the most efficient payment instrument, and the idea that people hold cash for precautionary reasons when facing uncertainty about their future purchases. The results of the simulations show that these two factors are significant determinants of the high shares of low-value cash payments in Canada, France and Germany. Yet, they are not so crucial in the Netherlands, which exhibits a significant share of low-value card transactions. We discuss how the differences in payment markets across countries may explain the differences in the performance of the model."
"2013-6","To Link or Not To Link? Netting and Exposures Between Central Counterparties","March 2013","Stacey Anderson,Jean-Philippe Dion,Héctor Pérez Saiz","TRUE,FALSE,TRUE","Payment clearing and settlement systems","G,G1,G18,G2,G23","http://www.bankofcanada.ca/wp-content/uploads/2013/03/wp2013-06.pdf","This paper provides a framework to compare linked and unlinked CCP configurations in terms of total netting achieved by market participants and the total system default exposures that exist between participants and CCPs. A total system perspective, taking both market participant and CCP exposures into account, is required to answer an important policy question faced by some smaller jurisdictions: whether or not to consider linking a domestic CCP with one or more offshore CCPs. Generally, a single global CCP results in the lowest total system exposure as it allows for multilateral netting across all participants while avoiding the creation of inter-CCP exposures via links. However, global clearing may not be appropriate for all markets. Using a two country model, with a global CCP serving both markets and a local CCP clearing only domestic country participants’ transactions, we show that establishing links between two CCPs leads to higher exposures for the domestic CCP and can result in a decrease in overall netting efficiency and higher total system exposures when the number of participants at the local CCP is small relative to the number of participants at the global CCP. As the relative weight applied by decision makers to CCP exposures as compared to market participants’ exposures increases, so does the number of domestic participants required to make the linked case preferred from a total system perspective. Our results imply that the establishment of a link between a small domestic CCP and a larger global CCP is unlikely to be desirable from a total system perspective in the majority of cases."
"2013-7","A Tractable Monetary Model Under General Preferences","March 2013","Tsz-Nga Wong","TRUE","Economic models","D,D8,D83,E,E4,E40","http://www.bankofcanada.ca/wp-content/uploads/2013/03/wp2013-07.pdf","Consider the monetary model of Lagos and Wright (JPE 2005) but with general preferences and general production. I show that preferences satisfying UXXUHH – (UXH)2 = 0 is a sufficient condition for the existence and uniqueness of monetary equilibrium with degenerate money distribution. I solve for the entire class of exact solutions to the above non-linear second order partial differential equation. This class of preferences includes ones with constant return to scale, for example, constant elasticity of substitution (CES), and ones used in many other macroeconomics literatures. I also analyze the welfare implication of monetary policy in this economy."
"2013-8","Countercyclical Bank Capital Requirement and Optimized Monetary Policy Rules","April 2013","Carlos De Resende,Ali Dib,René Lalonde,Nikita Perevalov","FALSE,FALSE,FALSE,FALSE","Economic models,Financial Institutions,Financial stability,International topics","E,E3,E32,E4,E44,E5,G,G1,G2","http://www.bankofcanada.ca/wp-content/uploads/2013/04/wp2013-08.pdf","Using BoC-GEM-Fin, a large-scale DSGE model with real, nominal and financial frictions featuring a banking sector, we explore the macroeconomic implications of various types of countercyclical bank capital regulations. Results suggest that countercyclical capital requirements have a significant stabilizing effect on key macroeconomic variables, but mostly after financial shocks. Moreover, the bank capital regulatory policy and monetary policy interact, and this interaction is contingent on the type of shocks that drive the economic cycle."
"2013-9","An Equilibrium Analysis of the Rise in House Prices and Mortgage Debt","April 2013","Shaofeng Xu","TRUE","Asset Pricing,Credit and credit aggregates,Economic models","E,E2,E21,E4,E44,G,G1,G11,R,R2,R21","http://www.bankofcanada.ca/wp-content/uploads/2013/04/wp2013-09.pdf","This paper examines the contributions of population aging, mortgage innovation and historically low interest rates to the sharp rise in U.S. house prices and mortgage debt between 1994 and 2005. I construct an overlapping generations general equilibrium housing model and find that these three factors together account for over half of the increase in house prices and most of the increase in mortgage debt during this period. Population aging contributes to rising house prices and mortgage debt, but it accounts for only a small portion of their observed changes. Meanwhile, mortgage innovation significantly increases the mortgage borrowing of various age cohorts, but it has a trivial effect on house prices because interest rates rise due to higher demand for mortgage loans. This increases households’ savings in financial assets and leaves their housing assets nearly unchanged. The observed run-up in house prices can, however, be justified in an open-economy setting where interest rates fall due to a global saving glut. Declining interest rates force households at prime saving ages to reallocate their wealth from financial assets to housing assets, which dramatically drives up house prices."
"2014-1","Household Risk Management and Actual Mortgage Choice in the Euro Area","January 2014","Michael Ehrmann,Michael Ziegelmeyer","FALSE,FALSE","Credit and credit aggregates,Transmission of monetary policy","D,D1,D12,E,E4,E43,E5,E52,G,G2,G21","http://www.bankofcanada.ca/wp-content/uploads/2014/01/wp2014-1.pdf","Mortgages constitute the largest part of household debt. An essential choice when taking out a mortgage is between fixed-interest-rate mortgages (FRMs) and adjustable-interest-rate mortgages (ARMs). However, so far, no comprehensive cross‐country study has analyzed what determines household demand for mortgage types, a task that this paper takes up using new data for the euro area. Our results support the hypothesis of Campbell and Cocco (2003) that the decision is best described as household risk management: income volatility reduces the take‐out of ARMs, while increasing duration and relative size of the mortgages increase it. Controlling for other supply factors through country fixed effects, loan pricing also matters, as expected, with ARMs becoming more attractive when yield spreads rise. The paper also conducts a simulation exercise to identify how the easing of monetary policy during the financial crisis affected mortgage holders. It shows that the resulting reduction in mortgage rates produced a substantial decline in debt burdens among mortgage‐holding households, especially in countries where households have higher debt burdens and a larger share of ARMs, as well as for some disadvantaged groups of households, such as those with low income."
"2014-10","Macroeconomic Experiences and Risk Taking of Euro Area Households","March 2014","Miguel Ampudia,Michael Ehrmann","TRUE,FALSE","Sectoral balance sheet","D,D0,D03,D1,D14,D8,D83,G,G1,G11","http://www.bankofcanada.ca/wp-content/uploads/2014/03/wp2014-10.pdf","This paper studies to what extent the experiences of households shape their willingness to take financial risks. It follows the methodology of Malmendier and Nagel (2011) and applies it to a novel data set on household finances covering euro area households. We show that experienced stock market returns matter in a statistically significant and economically substantial fashion: better experiences increase the financial risk households are willing to take as well as stock market participation along the intensive and the extensive margin. We find that more distant experiences receive a somewhat lower (but still substantial) weight than the corresponding findings suggest for the United States. Furthermore, there are additional effects stemming from the experience of extreme stock market downturns. Households in countries that witnessed a particularly severe 2008 stock market crash give substantially more weight to the most recent experience, suggesting that in these countries an even more pronounced underinvestment in the stock market should be expected in the years to come. The evidence highlights the relevance of personal experiences for household behavior."
"2014-11","Do High-Frequency Financial Data Help Forecast Oil Prices? The MIDAS Touch at Work","March 2014","Christiane Baumeister,Pierre Guérin,Lutz Kilian","FALSE,FALSE,FALSE","Econometric and statistical methods,International topics","C,C5,C53,G,G1,G14,Q,Q4,Q43","http://www.bankofcanada.ca/wp-content/uploads/2014/03/wp2014-11.pdf","The substantial variation in the real price of oil since 2003 has renewed interest in the question of how to forecast monthly and quarterly oil prices. There also has been increased interest in the link between financial markets and oil markets, including the question of whether financial market information helps forecast the real price of oil in physical markets. An obvious advantage of financial and energy market data in forecasting oil prices is their availability in real time on a daily or weekly basis. We investigate whether mixed-frequency models can be used to take advantage of these rich data sets. We show that, among a range of alternative high-frequency predictors, changes in U.S. crude oil inventories produce substantial and statistically significant real-time improvements in forecast accuracy. The preferred mixed-data sampling (MIDAS) model reduces the mean-squared prediction error by as much as 16 percent compared with the no-change forecast and has statistically significant directional accuracy as high as 80 percent. This MIDAS forecast also is more accurate than a mixed-frequency real-time vector autoregressive forecast, but not systematically more accurate than the corresponding forecast based on monthly inventories. We conclude that typically not much is lost by ignoring high-frequency financial data in forecasting the monthly real price of oil."
"2014-12","Do Sunspots Matter? Evidence from an Experimental Study of Bank Runs","March 2014","Jasmina Arifovic,Janet Hua Jiang","FALSE,TRUE","Financial markets,Financial stability","C,C9,C91,C92,D,D8,D80,E,E5,E58,G,G2,G20","http://www.bankofcanada.ca/wp-content/uploads/2014/03/wp2014-12.pdf","A ""sunspot"" is a variable that has no direct impact on the economy’s fundamental condition, such as preferences, endowments or technologies, but may nonetheless affect economic outcomes through the expectations channel as a coordination device. This paper investigates how people react to sunspots in the context of a bank-run game in a controlled laboratory environment. The sunspot variable is a series of random public announcements predicting withdrawal outcomes. The treatment variable is the coordination parameter, defined as the minimum fraction of depositors required to wait so that waiting entails a higher payoff than withdrawing. We conduct treatments with a high, low and intermediate value of the coordination parameter. Although theory predicts that sunspot equilibria exist in all treatments, strong responses to sunspots only occur in the treatment featuring the intermediate value of the coordination parameter where strategic uncertainty is high. The policy implication is that people tend to respond strongly to public announcements during times of uncertainty. In those situations, communication to the public must be treated with extra care."
"2014-13","Bond Risk Premia and Gaussian Term Structure Models","April 2014","Bruno Feunou,Jean-Sébastien Fontaine","TRUE,TRUE","Asset Pricing,Interest rates","E,E4,E43,E47,G,G1,G12","http://www.bankofcanada.ca/wp-content/uploads/2014/04/wp2014-13.pdf","Cochrane and Piazzesi (2005) show that (i) lagged forward rates improve the predictability of annual bond returns, adding to current forward rates, and that (ii) a Markovian model for monthly forward rates cannot generate the pattern of predictability in annual returns. These results stand as a challenge to modern Markovian dynamic term structure models (DTSMs). We develop the family of conditional mean DTSMs where the yield dynamics depend on current yields and their history. Empirically, we find that (i) current and past yields generate cyclical risk-premium variations, (ii) the model risk premia offer better returns forecasts, and (iii) the model coefficients are close to Cochrane-Piazzesi regressions of long-horizon returns. Yield decompositions differ significantly from what a standard model suggests - the expectation component decreases less in a recession and increases less in the recovery. A small Markovian factor “hidden” in measurement error (Duffee, 2011) explains some of the differences but is not sufficient to match the evidence."
